"","titulo","titulo original","ano","classificacao","duracao","enredo","nota","diretor","roteristas","poster"
"1","Um Sonho de Liberdade","Original title: The Shawshank Redemption","1994","16","2h 22m","Over the course of several years, two convicts form a friendship, seeking consolation and, eventually, redemption through basic compassion.","9.3","Frank Darabont","Stephen King/Frank Darabont","https://m.media-amazon.com/images/M/MV5BNDE3ODcxYzMtY2YzZC00NmNlLWJiNDMtZDViZWM2MzIxZDYwXkEyXkFqcGdeQXVyNjAwNDUxODI@._V1_.jpg"
"2","O Poderoso Chefão","Original title: The Godfather","1972","14","2h 55m","Don Vito Corleone, head of a mafia family, decides to hand over his empire to his youngest son Michael. However, his decision unintentionally puts the lives of his loved ones in grave danger.","9.2","Francis Ford Coppola","Mario Puzo/Francis Ford Coppola","https://m.media-amazon.com/images/M/MV5BZjgwNzE5ODgtYzAyZC00YTZhLThhNDktMDVlOGNhYzk5NTVkXkEyXkFqcGdeQXVyMTAzMDM4MjM0._V1_.jpg"
"3","Batman: O Cavaleiro das Trevas","Original title: The Dark Knight","2008","12","2h 32m","When the menace known as the Joker wreaks havoc and chaos on the people of Gotham, Batman must accept one of the greatest psychological and physical tests of his ability to fight injustice.","9.0","Christopher Nolan","Jonathan Nolan/Christopher Nolan/David S. Goyer","https://m.media-amazon.com/images/M/MV5BM2E1ZjEyYWQtMjgyMy00ZTkwLThkM2QtN2YwM2NmYzAyYjE0XkEyXkFqcGdeQXVyMTAzMDM4MjM0._V1_.jpg"
"4","O Poderoso Chefão II","Original title: The Godfather Part II","1974","14","3h 22m","The early life and career of Vito Corleone in 1920s New York City is portrayed, while his son, Michael, expands and tightens his grip on the family crime syndicate.","9.0","Francis Ford Coppola","Francis Ford Coppola/Mario Puzo","https://m.media-amazon.com/images/M/MV5BOGM2M2Q0ZWQtZjc5NC00NDY4LWIxYTktMDE4ZjIyYTRlNTIyXkEyXkFqcGdeQXVyODc0OTEyNDU@._V1_.jpg"
"5","12 Homens e uma Sentença","Original title: 12 Angry Men","1957","Livre","1h 36m","The jury in a New York City murder trial is frustrated by a single member whose skeptical caution forces them to more carefully consider the evidence before jumping to a hasty verdict.","9.0","Sidney Lumet","Reginald Rose","https://m.media-amazon.com/images/M/MV5BODRmNWRiYmUtNGM2Yy00NTgwLTgxNzMtMGExYzI5NjllNjBhXkEyXkFqcGdeQXVyMTAzMDM4MjM0._V1_.jpg"
"6","A Lista de Schindler","Original title: Schindler's List","1993","14","3h 15m","In German-occupied Poland during World War II, industrialist Oskar Schindler gradually becomes concerned for his Jewish workforce after witnessing their persecution by the Nazis.","9.0","Steven Spielberg","Thomas Keneally/Steven Zaillian","https://m.media-amazon.com/images/M/MV5BYjM5ZjYxNjQtZjdhYi00NzBiLTgyNGItOGU3YTYwYWE0NmEzXkEyXkFqcGdeQXVyMTAzMDM4MjM0._V1_.jpg"
"7","O Senhor dos Anéis: O Retorno do Rei","Original title: The Lord of the Rings: The Return of the King","2003","14","3h 21m","Gandalf and Aragorn lead the World of Men against Sauron's army to draw his gaze from Frodo and Sam as they approach Mount Doom with the One Ring.","9.0","Peter Jackson","J.R.R. Tolkien/Fran Walsh/Philippa Boyens","https://m.media-amazon.com/images/M/MV5BNzZiOTI4MWItZGMxZC00NjZkLWJlOWUtMDY5YzE1NzhiNGRhXkEyXkFqcGdeQXVyODc0OTEyNDU@._V1_.jpg"
"8","Pulp Fiction: Tempo de Violência","Original title: Pulp Fiction","1994","18","2h 34m","The lives of two mob hitmen, a boxer, a gangster and his wife, and a pair of diner bandits intertwine in four tales of violence and redemption.","8.9","Quentin Tarantino","Quentin Tarantino/Roger Avary","https://m.media-amazon.com/images/M/MV5BN2RiMTA1ZGQtOTNhYi00MjQyLTk0MzAtMWE1OTM2NWUxNzBkXkEyXkFqcGdeQXVyMTAzMDM4MjM0._V1_.jpg"
"9","O Senhor dos Anéis: A Sociedade do Anel","Original title: The Lord of the Rings: The Fellowship of the Ring","2001","12","2h 58m","A meek Hobbit from the Shire and eight companions set out on a journey to destroy the powerful One Ring and save Middle-earth from the Dark Lord Sauron.","8.8","Peter Jackson","J.R.R. Tolkien/Fran Walsh/Philippa Boyens","https://m.media-amazon.com/images/M/MV5BNDEyMzU0ODUtMTdjOS00Y2E2LWJlZmEtYmJjMmQ2NWZlNGQ1XkEyXkFqcGdeQXVyMTAzMDM4MjM0._V1_.jpg"
"10","Três Homens em Conflito","Original title: Il buono, il brutto, il cattivo","1966","14","2h 41m","A bounty hunting scam joins two men in an uneasy alliance against a third in a race to find a fortune in gold buried in a remote cemetery.","8.8","Sergio Leone","Luciano Vincenzoni/Sergio Leone/Agenore Incrocci","https://m.media-amazon.com/images/M/MV5BNjJlYmNkZGItM2NhYy00MjlmLTk5NmQtNjg1NmM2ODU4OTMwXkEyXkFqcGdeQXVyMjUzOTY1NTc@._V1_.jpg"
"11","Forrest Gump: O Contador de Histórias","Original title: Forrest Gump","1994","14","2h 22m","The presidencies of Kennedy and Johnson, the Vietnam War, the Watergate scandal and other historical events unfold from the perspective of an Alabama man with an IQ of 75, whose only desire is to be reunited with his childhood sweetheart.","8.8","Robert Zemeckis","Winston Groom/Eric Roth","https://m.media-amazon.com/images/M/MV5BYWYwNWY0ZjMtYzUxZS00ODI3LTllNzctODNiNjhlNjcyNWM0XkEyXkFqcGdeQXVyMjcwMzM0OTI@._V1_.jpg"
"12","Clube da Luta","Original title: Fight Club","1999","18","2h 19m","An insomniac office worker and a devil-may-care soap maker form an underground fight club that evolves into much more.","8.8","David Fincher","Chuck Palahniuk/Jim Uhls","https://m.media-amazon.com/images/M/MV5BNDVhNjJlZmMtODJhOS00OWE4LTgxMzAtNjVlMzI0ZjI0OTMzXkEyXkFqcGdeQXVyMTAzMDM4MjM0._V1_.jpg"
"13","O Senhor dos Anéis: As Duas Torres","Original title: The Lord of the Rings: The Two Towers","2002","12","2h 59m","While Frodo and Sam edge closer to Mordor with the help of the shifty Gollum, the divided fellowship makes a stand against Sauron's new ally, Saruman, and his hordes of Isengard.","8.8","Peter Jackson","J.R.R. Tolkien/Fran Walsh/Philippa Boyens","https://m.media-amazon.com/images/M/MV5BZGMxZTdjZmYtMmE2Ni00ZTdkLWI5NTgtNjlmMjBiNzU2MmI5XkEyXkFqcGdeQXVyNjU0OTQ0OTY@._V1_.jpg"
"14","A Origem","Original title: Inception","2010","14","2h 28m","A thief who steals corporate secrets through the use of dream-sharing technology is given the inverse task of planting an idea into the mind of a C.E.O., but his tragic past may doom the project and his team to disaster.","8.8","Christopher Nolan","Christopher Nolan","https://m.media-amazon.com/images/M/MV5BN2NiZDM5ZjQtNGJjNy00NzhmLWI1NzktZTgzYTkyZDFmYTg2XkEyXkFqcGdeQXVyMTYzMDM0NTU@._V1_.jpg"
"15","Star Wars: Episódio V - O Império Contra-Ataca","Original title: Star Wars: Episode V - The Empire Strikes Back","1980","Livre","2h 4m","After the Rebels are overpowered by the Empire, Luke Skywalker begins his Jedi training with Yoda, while his friends are pursued across the galaxy by Darth Vader and bounty hunter Boba Fett.","8.7","Irvin Kershner","Leigh Brackett/Lawrence Kasdan/George Lucas","https://m.media-amazon.com/images/M/MV5BNDQxYTExOWQtMzE4Zi00Yzg2LWEzYjUtMTBjMDdiYmY3ZTdjXkEyXkFqcGdeQXVyODc0OTEyNDU@._V1_.jpg"
"16","Matrix","Original title: The Matrix","1999","14","2h 16m","When a beautiful stranger leads computer hacker Neo to a forbidding underworld, he discovers the shocking truth--the life he knows is the elaborate deception of an evil cyber-intelligence.","8.7","Lana Wachowski/Lilly Wachowski","Lilly Wachowski/Lana Wachowski","https://m.media-amazon.com/images/M/MV5BNjdlN2RiNWMtY2U5MC00YTYwLTg2NjAtY2E3NGQ2OThkOWNlXkEyXkFqcGdeQXVyNTk2MDQ0MjA@._V1_.jpg"
"17","Os Bons Companheiros","Original title: GoodFellas","1990","14","2h 25m","The story of Henry Hill and his life in the mafia, covering his relationship with his wife Karen and his mob partners Jimmy Conway and Tommy DeVito.","8.7","Martin Scorsese","Nicholas Pileggi/Martin Scorsese","https://m.media-amazon.com/images/M/MV5BOTI1ZWU1MWUtYzRjZC00ZjA3LTliOTMtZjkxYTczYTE2N2YwXkEyXkFqcGdeQXVyMTAzMDM4MjM0._V1_.jpg"
"18","Um Estranho no Ninho","Original title: One Flew Over the Cuckoo's Nest","1975","16","2h 13m","In the Fall of 1963, a Korean War veteran and criminal pleads insanity and is admitted to a mental institution, where he rallies up the scared patients against the tyrannical nurse.","8.7","Milos Forman","Lawrence Hauben/Bo Goldman/Ken Kesey","https://m.media-amazon.com/images/M/MV5BYjBlZjA2OTctZjVjMS00YzYzLTk3NDYtNjc4ZWVmNzQyNjZkXkEyXkFqcGdeQXVyMTAyOTE2ODg0._V1_.jpg"
"19","Seven: Os Sete Crimes Capitais","Original title: Se7en","1995","14","2h 7m","Two detectives, a rookie and a veteran, hunt a serial killer who uses the seven deadly sins as his motives.","8.6","David Fincher","Andrew Kevin Walker","https://m.media-amazon.com/images/M/MV5BZDgyZmY5MmItY2I3Ny00NjA4LWFhNmItMGQ4ZGJhZDk5YjU3XkEyXkFqcGdeQXVyMTAzMDM4MjM0._V1_.jpg"
"20","A Felicidade Não se Compra","Original title: It's a Wonderful Life","1946","Livre","2h 10m","An angel is sent from Heaven to help a desperately frustrated businessman by showing him what life would have been like if he had never existed.","8.6","Frank Capra","Frances Goodrich/Albert Hackett/Frank Capra","https://m.media-amazon.com/images/M/MV5BMTYyOTAzZDUtMWUzYS00MjY4LTlmMTgtMGI5NzdmMWI5Y2FmXkEyXkFqcGdeQXVyODc0OTEyNDU@._V1_.jpg"
"21","Os Sete Samurais","Original title: Shichinin no samurai","1954","10","3h 27m","Farmers from a village exploited by bandits hire a veteran samurai for protection, who gathers six other samurai to join him.","8.6","Akira Kurosawa","Akira Kurosawa/Shinobu Hashimoto/Hideo Oguni","https://m.media-amazon.com/images/M/MV5BNWQ3OTM4ZGItMWEwZi00MjI5LWI3YzgtNTYwNWRkNmIzMGI5XkEyXkFqcGdeQXVyNDY2MTk1ODk@._V1_.jpg"
"22","O Silêncio dos Inocentes","Original title: The Silence of the Lambs","1991","14","1h 58m","A young F.B.I. cadet must receive the help of an incarcerated and manipulative cannibal killer to help catch another serial killer, a madman who skins his victims.","8.6","Jonathan Demme","Thomas Harris/Ted Tally","https://m.media-amazon.com/images/M/MV5BMzNkMGM2OWItYmNiYS00YmZhLTg0ZjctOGYxMTE2ODZmNGFiXkEyXkFqcGdeQXVyMTAzMDM4MjM0._V1_.jpg"
"23","O Resgate do Soldado Ryan","Original title: Saving Private Ryan","1998","14","2h 49m","Following the Normandy Landings, a group of U.S. soldiers go behind enemy lines to retrieve a paratrooper whose brothers have been killed in action.","8.6","Steven Spielberg","Robert Rodat","https://m.media-amazon.com/images/M/MV5BMTYyMDRiNTQtNjY4NC00MWI1LWIyZTAtYjQ1ZDJjMjdkYzM0XkEyXkFqcGdeQXVyODc0OTEyNDU@._V1_.jpg"
"24","Cidade de Deus","Cidade de Deus","2002","18","2h 10m","In the slums of Rio, two kids' paths diverge as one struggles to become a photographer and the other a kingpin.","8.6","Fernando Meirelles/Kátia Lund","Paulo Lins/Bráulio Mantovani","https://m.media-amazon.com/images/M/MV5BOTMwYjc5ZmItYTFjZC00ZGQ3LTlkNTMtMjZiNTZlMWQzNzI5XkEyXkFqcGdeQXVyNzkwMjQ5NzM@._V1_.jpg"
"25","Interestelar","Original title: Interstellar","2014","10","2h 49m","When Earth becomes uninhabitable in the future, a farmer and ex-NASA pilot, Joseph Cooper, is tasked to pilot a spacecraft, along with a team of researchers, to find a new planet for humans.","8.7","Christopher Nolan","Jonathan Nolan/Christopher Nolan","https://m.media-amazon.com/images/M/MV5BMzg0NzYyNDMtZTkxMS00NmYzLWJkMDAtMmNlYTY1MTRmM2IwXkEyXkFqcGdeQXVyMTYzMDM0NTU@._V1_.jpg"
"26","A Vida é Bela","Original title: La vita è bella","1997","Livre","1h 56m","When an open-minded Jewish waiter and his son become victims of the Holocaust, he uses a perfect mixture of will, humor and imagination to protect his son from the dangers around their camp.","8.6","Roberto Benigni","Vincenzo Cerami/Roberto Benigni","https://m.media-amazon.com/images/M/MV5BYTY3M2NhODAtMTRiNC00OThlLTg3YTAtNjIwNjU2Zjg1MDFhXkEyXkFqcGdeQXVyMTAyOTE2ODg0._V1_.jpg"
"27","À Espera de um Milagre","Original title: The Green Mile","1999","18","3h 9m","A tale set on death row in a Southern jail, where gentle giant John possesses the mysterious power to heal people's ailments. When the lead guard, Paul, recognizes John's gift, he tries to help stave off the condemned man's execution.","8.6","Frank Darabont","Stephen King/Frank Darabont","https://m.media-amazon.com/images/M/MV5BODM5ODQxYWYtYjViYy00ZTYzLWI2YmQtZDMyYzUzZDE5M2M4XkEyXkFqcGdeQXVyMTAzMDM4MjM0._V1_.jpg"
"28","Star Wars: Episódio IV - Uma Nova Esperança","Original title: Star Wars","1977","Livre","2h 1m","Luke Skywalker joins forces with a Jedi Knight, a cocky pilot, a Wookiee and two droids to save the galaxy from the Empire's world-destroying battle station, while also attempting to rescue Princess Leia from the mysterious Darth Vader.","8.6","George Lucas","George Lucas","https://m.media-amazon.com/images/M/MV5BOTA5NjhiOTAtZWM0ZC00MWNhLThiMzEtZDFkOTk2OTU1ZDJkXkEyXkFqcGdeQXVyMTA4NDI1NTQx._V1_.jpg"
"29","O Exterminador do Futuro 2: O Julgamento Final","Original title: Terminator 2: Judgment Day","1991","14","2h 17m","A cyborg, identical to the one who failed to kill Sarah Connor, must now protect her 10-year old son John from an even more advanced and powerful cyborg.","8.6","James Cameron","James Cameron/William Wisher","https://m.media-amazon.com/images/M/MV5BMGU1NGNiYWUtY2UwYi00OWE5LTliNzItMDUyNzYyNmQ2Njg4XkEyXkFqcGdeQXVyNTk2MDQ0MjA@._V1_.jpg"
"30","De Volta para o Futuro","Original title: Back to the Future","1985","Livre","1h 56m","Marty McFly, a 17-year-old high school student, is accidentally sent 30 years into the past in a time-traveling DeLorean invented by his close friend, the maverick scientist Doc Brown.","8.5","Robert Zemeckis","Robert Zemeckis/Bob Gale","https://m.media-amazon.com/images/M/MV5BYzA0YTY4NTctYTg2Mi00MzNhLWJiMmYtNjNhMTk1MTBmZDU3XkEyXkFqcGdeQXVyMTAzMDM4MjM0._V1_.jpg"
"31","A Viagem de Chihiro","Original title: Sen to Chihiro no kamikakushi","2001","Livre","2h 5m","During her family's move to the suburbs, a sullen 10-year-old girl wanders into a world ruled by gods, witches and spirits, a world where humans are changed into beasts.","8.6","Hayao Miyazaki","Hayao Miyazaki","https://m.media-amazon.com/images/M/MV5BMjlmZmI5MDctNDE2YS00YWE0LWE5ZWItZDBhYWQ0NTcxNWRhXkEyXkFqcGdeQXVyMTMxODk2OTU@._V1_.jpg"
"32","O Pianista","Original title: The Pianist","2002","14","2h 30m","A Polish Jewish musician struggles to survive the destruction of the Warsaw ghetto of World War II.","8.5","Roman Polanski","Ronald Harwood/Wladyslaw Szpilman","https://m.media-amazon.com/images/M/MV5BZTQ5MmY1M2EtNGIwNy00N2E2LTg3YTQtYTZkNjlhYTYwMzk5XkEyXkFqcGdeQXVyMTAzMDM4MjM0._V1_.jpg"
"33","Psicose","Original title: Psycho","1960","14","1h 49m","A Phoenix secretary embezzles $40,000 from her employer's client, goes on the run and checks into a remote motel run by a young man under the domination of his mother.","8.5","Alfred Hitchcock","Joseph Stefano/Robert Bloch","https://m.media-amazon.com/images/M/MV5BY2QzYTNmN2QtMmM3MC00NWRhLThiOWYtZGJkMTEyMjI3YTkxXkEyXkFqcGdeQXVyMTAyOTE2ODg0._V1_.jpg"
"34","Parasita","Original title: Gisaengchung","2019","16","2h 12m","Greed and class discrimination threaten the newly formed symbiotic relationship between the wealthy Park family and the destitute Kim clan.","8.5","Bong Joon Ho","Bong Joon Ho/Han Jin-won","https://m.media-amazon.com/images/M/MV5BYWZjMjk3ZTItODQ2ZC00NTY5LWE0ZDYtZTI3MjcwN2Q5NTVkXkEyXkFqcGdeQXVyODk4OTc3MTY@._V1_.jpg"
"35","O Profissional","Original title: Léon","1994","14","1h 50m","12-year-old Mathilda is reluctantly taken in by Léon, a professional assassin, after her family is murdered. An unusual relationship forms as she becomes his protégée and learns the assassin's trade.","8.5","Luc Besson","Luc Besson","https://m.media-amazon.com/images/M/MV5BZjZhNjU0Y2ItNDhmMC00NzhhLWJlMmMtZDAwMWU5MzU3Zjg3XkEyXkFqcGdeQXVyMTAyOTE2ODg0._V1_.jpg"
"36","Gladiador","Original title: Gladiator","2000","14","2h 35m","A former Roman General sets out to exact vengeance against the corrupt emperor who murdered his family and sent him into slavery.","8.5","Ridley Scott","David Franzoni/John Logan/William Nicholson","https://m.media-amazon.com/images/M/MV5BZjdiZTI5YTgtZDdiNi00YzhmLTllMWEtZDM1ZjJiMzUyYTc5XkEyXkFqcGdeQXVyMTAyOTE2ODg0._V1_.jpg"
"37","O Rei Leão","Original title: The Lion King","1994","Livre","1h 28m","Lion prince Simba and his father are targeted by his bitter uncle, who wants to ascend the throne himself.","8.5","Roger Allers/Rob Minkoff","Irene Mecchi/Jonathan Roberts/Linda Woolverton","https://m.media-amazon.com/images/M/MV5BOWMwNzYzMjAtMDUwMS00YzEyLTlmZGQtNzUwNGVlMDkwNTcwXkEyXkFqcGdeQXVyMTAzMDM4MjM0._V1_.jpg"
"38","A Outra História Americana","Original title: American History X","1998","14","1h 59m","Living a life marked by violence, neo-Nazi Derek finally goes to prison after killing two black youths. Upon his release, Derek vows to change; he hopes to prevent his brother, Danny, who idolizes Derek, from following in his footsteps.","8.5","Tony Kaye","David McKenna","https://m.media-amazon.com/images/M/MV5BMDk4OTcwMjQtOWRiOS00OTM0LWIxZDgtOWFmNjdlYTIyMDc2XkEyXkFqcGdeQXVyMTAyOTE2ODg0._V1_.jpg"
"39","Os Infiltrados","Original title: The Departed","2006","18","2h 31m","An undercover cop and a mole in the police attempt to identify each other while infiltrating an Irish gang in South Boston.","8.5","Martin Scorsese","William Monahan/Alan Mak/Felix Chong","https://m.media-amazon.com/images/M/MV5BYTUxMGZhYjUtYWFiMC00NDE2LTkwMzMtM2U0ZjA4ZTg4MjI1XkEyXkFqcGdeQXVyMTAzMDM4MjM0._V1_.jpg"
"40","Whiplash: Em Busca da Perfeição","Original title: Whiplash","2014","12","1h 46m","A promising young drummer enrolls at a cut-throat music conservatory where his dreams of greatness are mentored by an instructor who will stop at nothing to realize a student's potential.","8.5","Damien Chazelle","Damien Chazelle","https://m.media-amazon.com/images/M/MV5BZjZiNTFmNzAtMzFiMi00ZmFmLTkzZDItZWQzNGJkZjk5NGNlXkEyXkFqcGdeQXVyMTAyOTE2ODg0._V1_.jpg"
"41","O Grande Truque","Original title: The Prestige","2006","14","2h 10m","After a tragic accident, two stage magicians in 1890s London engage in a battle to create the ultimate illusion while sacrificing everything they have to outwit each other.","8.5","Christopher Nolan","Jonathan Nolan/Christopher Nolan/Christopher Priest","https://m.media-amazon.com/images/M/MV5BYjljNGQ2OWMtZWI2NC00NGQ5LWE3MTctODg3ZDllNGMxZGZiXkEyXkFqcGdeQXVyMTAzMDM4MjM0._V1_.jpg"
"42","Os Suspeitos","Original title: The Usual Suspects","1995","14","1h 46m","The sole survivor of a pier shoot-out tells the story of how a notorious criminal influenced the events that began with five criminals meeting in a seemingly random police lineup.","8.5","Bryan Singer","Christopher McQuarrie","https://m.media-amazon.com/images/M/MV5BOGE5NDRjNzctZDk2Zi00OGVjLWI4YzgtNzRkMjdjZjRhNmFjXkEyXkFqcGdeQXVyMTAzMDM4MjM0._V1_.jpg"
"43","Casablanca","Casablanca","1942","Livre","1h 42m","A cynical expatriate American cafe owner struggles to decide whether or not to help his former lover and her fugitive husband escape the Nazis in French Morocco.","8.5","Michael Curtiz","Julius J. Epstein/Philip G. Epstein/Howard Koch","https://m.media-amazon.com/images/M/MV5BY2IzZGY2YmEtYzljNS00NTM5LTgwMzUtMzM1NjQ4NGI0OTk0XkEyXkFqcGdeQXVyNDYyMDk5MTU@._V1_.jpg"
"44","Túmulo dos Vagalumes","Original title: Hotaru no haka","1988","12","1h 29m","A young boy and his little sister struggle to survive in Japan during World War II.","8.5","Isao Takahata","Akiyuki Nosaka/Isao Takahata","https://m.media-amazon.com/images/M/MV5BNDU1OWExYjYtOTZlMy00MWY5LThkOGMtZjBhNDdiYTY4YTM0XkEyXkFqcGdeQXVyMTAyOTE2ODg0._V1_.jpg"
"45","Harakiri","Original title: Seppuku","1962","16","2h 13m","When a ronin requesting seppuku at a feudal lord's palace is told of the brutal suicide of another ronin who previously visited, he reveals how their pasts are intertwined - and in doing so challenges the clan's integrity.","8.6","Masaki Kobayashi","Yasuhiko Takiguchi/Shinobu Hashimoto","https://m.media-amazon.com/images/M/MV5BYjBmYTQ1NjItZWU5MS00YjI0LTg2OTYtYmFkN2JkMmNiNWVkXkEyXkFqcGdeQXVyMTMxMTY0OTQ@._V1_.jpg"
"46","Intocáveis","Original title: Intouchables","2011","14","1h 52m","After he becomes a quadriplegic from a paragliding accident, an aristocrat hires a young man from the projects to be his caregiver.","8.5","Olivier Nakache/Éric Toledano","Olivier Nakache/Éric Toledano/Philippe Pozzo di Borgo","https://m.media-amazon.com/images/M/MV5BMTYxNDA3MDQwNl5BMl5BanBnXkFtZTcwNTU4Mzc1Nw@@._V1_.jpg"
"47","Tempos Modernos","Original title: Modern Times","1936","Livre","1h 27m","The Tramp struggles to live in modern industrial society with the help of a young homeless woman.","8.5","Charles Chaplin","Charles Chaplin","https://m.media-amazon.com/images/M/MV5BYzk1MDkxMWUtMTFmYS00YzA0LWE1YjctZjAxNjUwZTJkNTZkXkEyXkFqcGdeQXVyMDUyOTUyNQ@@._V1_.jpg"
"48","Era uma Vez no Oeste","Original title: C'era una volta il West","1968","14","2h 45m","A mysterious stranger with a harmonica joins forces with a notorious desperado to protect a beautiful widow from a ruthless assassin working for the railroad.","8.5","Sergio Leone","Sergio Donati/Sergio Leone/Dario Argento","https://m.media-amazon.com/images/M/MV5BODQ3NDExOGYtMzI3Mi00NWRlLTkwNjAtNjc4MDgzZGJiZTA1XkEyXkFqcGdeQXVyMjUzOTY1NTc@._V1_.jpg"
"49","Cinema Paradiso","Original title: Nuovo Cinema Paradiso","1988","10","2h 35m","A filmmaker recalls his childhood when falling in love with the pictures at the cinema of his home village and forms a deep friendship with the cinema's projectionist.","8.5","Giuseppe Tornatore","Giuseppe Tornatore/Vanna Paoli","https://m.media-amazon.com/images/M/MV5BM2FhYjEyYmYtMDI1Yy00YTdlLWI2NWQtYmEzNzAxOGY1NjY2XkEyXkFqcGdeQXVyNTA3NTIyNDg@._V1_.jpg"
"50","Janela Indiscreta","Original title: Rear Window","1954","12","1h 52m","A photographer in a wheelchair spies on his neighbors from his Greenwich Village courtyard apartment window, and becomes convinced one of them has committed murder, despite the skepticism of his fashion-model girlfriend.","8.5","Alfred Hitchcock","John Michael Hayes/Cornell Woolrich","https://m.media-amazon.com/images/M/MV5BMjE4YjMxZGEtYTBmMi00OTQwLThjN2EtN2Y0ZGJjMmMxOWM4XkEyXkFqcGdeQXVyMTAyOTE2ODg0._V1_.jpg"
"51","Alien - O 8º Passageiro","Original title: Alien","1979","14","1h 57m","The crew of a commercial spacecraft encounter a deadly lifeform after investigating an unknown transmission.","8.5","Ridley Scott","Dan O'Bannon/Ronald Shusett","https://m.media-amazon.com/images/M/MV5BOGQzZTBjMjQtOTVmMS00NGE5LWEyYmMtOGQ1ZGZjNmRkYjFhXkEyXkFqcGdeQXVyMjUzOTY1NTc@._V1_.jpg"
"52","Luzes da Cidade","Original title: City Lights","1931","Livre","1h 27m","With the aid of a wealthy erratic tippler, a dewy-eyed tramp who has fallen in love with a sightless flower girl accumulates money to be able to help her medically.","8.5","Charles Chaplin","Charles Chaplin/Harry Carr/Harry Crocker","https://m.media-amazon.com/images/M/MV5BY2I4MmM1N2EtM2YzOS00OWUzLTkzYzctNDc5NDg2N2IyODJmXkEyXkFqcGdeQXVyNzkwMjQ5NzM@._V1_.jpg"
"53","Apocalypse Now","Apocalypse Now","1979","16","2h 27m","A U.S. Army officer serving in Vietnam is tasked with assassinating a renegade Special Forces Colonel who sees himself as a god.","8.4","Francis Ford Coppola","John Milius/Francis Ford Coppola/Michael Herr","https://m.media-amazon.com/images/M/MV5BYmQyNTA1ZGItNjZjMi00NzFlLWEzMWEtNWMwN2Q2MjJhYzEyXkEyXkFqcGdeQXVyMjUzOTY1NTc@._V1_.jpg"
"54","Amnésia","Original title: Memento","2000","16","1h 53m","A man with short-term memory loss attempts to track down his wife's murderer.","8.4","Christopher Nolan","Christopher Nolan/Jonathan Nolan","https://m.media-amazon.com/images/M/MV5BNWQ5YjRkYTEtZWJmNi00ZjhjLWE2YTgtMDE5ODlkNzdhYTRhXkEyXkFqcGdeQXVyMTAyOTE2ODg0._V1_.jpg"
"55","Django Livre","Original title: Django Unchained","2012","16","2h 45m","With the help of a German bounty-hunter, a freed slave sets out to rescue his wife from a brutal plantation owner in Mississippi.","8.4","Quentin Tarantino","Quentin Tarantino","https://m.media-amazon.com/images/M/MV5BZGVjNDhlYmQtMzZkMS00ZjkxLTg5Y2MtYzk4ZjI5NzBhMDJmXkEyXkFqcGdeQXVyMTAzMDM4MjM0._V1_.jpg"
"56","Os Caçadores da Arca Perdida","Original title: Raiders of the Lost Ark","1981","Livre","1h 55m","In 1936, archaeologist and adventurer Indiana Jones is hired by the U.S. government to find the Ark of the Covenant before the Nazis can obtain its awesome powers.","8.4","Steven Spielberg","Lawrence Kasdan/George Lucas/Philip Kaufman","https://m.media-amazon.com/images/M/MV5BZWE3OGQwYWMtNjAxMi00YjI4LWI3OWUtZjhkZTgxYjdkZDA4XkEyXkFqcGdeQXVyNzg5MzIyOA@@._V1_.jpg"
"57","WALL·E","WALL·E","2008","Livre","1h 38m","In the distant future, a small waste-collecting robot inadvertently embarks on a space journey that will ultimately decide the fate of mankind.","8.4","Andrew Stanton","Andrew Stanton/Pete Docter/Jim Reardon","https://m.media-amazon.com/images/M/MV5BMjExMTg5OTU0NF5BMl5BanBnXkFtZTcwMjMxMzMzMw@@._V1_.jpg"
"58","A Vida dos Outros","Original title: Das Leben der Anderen","2006","12","2h 17m","In 1984 East Berlin, an agent of the secret police, conducting surveillance on a writer and his lover, finds himself becoming increasingly absorbed by their lives.","8.4","Florian Henckel von Donnersmarck","Florian Henckel von Donnersmarck","https://m.media-amazon.com/images/M/MV5BZmIxNDBhMTEtMTM0OS00OGM5LTlkZjYtNzNlOTk4MTM0NGQ4XkEyXkFqcGdeQXVyMTAyOTE2ODg0._V1_.jpg"
"59","Crepúsculo dos Deuses","Original title: Sunset Blvd.","1950","Livre","1h 50m","A screenwriter develops a dangerous relationship with a faded film star determined to make a triumphant return.","8.4","Billy Wilder","Charles Brackett/Billy Wilder/D.M. Marshman Jr.","https://m.media-amazon.com/images/M/MV5BMTU0NTkyNzYwMF5BMl5BanBnXkFtZTgwMDU0NDk5MTI@._V1_.jpg"
